{
  "task_id": "sample_3.traj",
  "domain": "math",
  "question": "Calculate the area of a circle with radius 5",
  "actions": [
    {
      "step": 1,
      "tool": "reason",
      "input": {
        "prompt": "Question: Calculate the area of a circle with radius 5"
      },
      "output": "I need to solve this step by step using Python."
    },
    {
      "step": 2,
      "tool": "bash",
      "input": {
        "command": "python3 -c 'print(\"Solving: Calculate the area of a circle with radius 5\")'"
      },
      "output": {
        "returncode": 0,
        "stdout": "Mock solution for: Calculate the area of a circle with radius 5",
        "stderr": ""
      }
    }
  ],
  "final_answer": "Mock answer for: Calculate the area of a circle with radius 5",
  "metadata": {
    "source_detected": "unknown"
  }
}