{
  "task_id": "math_1.traj",
  "domain": "math",
  "question": "23*19 + 7**3",
  "actions": [
    {
      "step": 1,
      "tool": "reason",
      "input": {
        "prompt": "Question:\n23*19 + 7**3\n\nFollow the output rules exactly."
      },
      "output": "THOUGHT: Calculate the product of 23 and 19, then add the cube of 7.\n```bash\npython -c \"print(23*19 + 7**3)\"\n```"
    },
    {
      "step": 2,
      "tool": "bash",
      "input": {
        "command": "python -c \"print(23*19 + 7**3)\""
      },
      "output": {
        "returncode": 0,
        "stdout": "780",
        "stderr": ""
      }
    },
    {
      "step": 3,
      "tool": "finalize",
      "input": {
        "context": "Latest command output:\n```\n780\n```"
      },
      "output": "Answer: 780"
    }
  ],
  "final_answer": "Answer: 780",
  "metadata": {
    "source_detected": "unknown"
  }
}