{
  "task_id": "sample_2.traj",
  "domain": "mhqa",
  "question": "What is the capital of France and what is its population?",
  "actions": [
    {
      "step": 1,
      "tool": "decompose",
      "input": {
        "prompt": "Question:\nWhat is the capital of France and what is its population?\n\nReturn 2â€“5 sub-questions as a numbered list."
      },
      "output": "1. What is the capital city of France?  \n2. What is the current population of that city?"
    },
    {
      "step": 2,
      "tool": "reason_hop",
      "input": {
        "hop": "What is the capital city of France?",
        "idx": 1,
        "prompt": "Original question:\nWhat is the capital of France and what is its population?\n\nPrior hop notes:\n(none)\n\nCurrent sub-question (1/2): What is the capital city of France?"
      },
      "output": "The capital city of France is Paris. It is well-known for its cultural landmarks and historical significance. \n\nProvisional answer: Paris."
    },
    {
      "step": 3,
      "tool": "reason_hop",
      "input": {
        "hop": "What is the current population of that city?",
        "idx": 2,
        "prompt": "Original question:\nWhat is the capital of France and what is its population?\n\nPrior hop notes:\n- The capital city of France is Paris. It is well-known for its cultural landmarks and historical significance. \n\nProvisional answer: Paris.\n\nCurrent sub-question (2/2): What is the current population of that city?"
      },
      "output": "As of the latest estimates in 2023, the population of Paris is approximately 2.1 million residents within the city limits, with a larger metropolitan area population of around 11 million. \n\nProvisional answer: Approximately 2.1 million."
    },
    {
      "step": 4,
      "tool": "finalize",
      "input": {
        "prompt": "Original question:\nWhat is the capital of France and what is its population?\n\nHop notes in order:\n1. The capital city of France is Paris. It is well-known for its cultural landmarks and historical significance. \n\nProvisional answer: Paris.\n2. As of the latest estimates in 2023, the population of Paris is approximately 2.1 million residents within the city limits, with a larger metropolitan area population of around 11 million. \n\nProvisional answer: Approximately 2.1 million.\n\nWrite the final answer."
      },
      "output": "The capital of France is Paris, and its population is approximately 2.1 million residents within the city limits."
    }
  ],
  "final_answer": "The capital of France is Paris, and its population is approximately 2.1 million residents within the city limits.",
  "metadata": {
    "source_detected": "mhqa"
  }
}